{
  "project_id": "ecocity-bnei-dan-54-56",
  "locale": "he-IL",
  "direction": "rtl",
  "publication_state": "draft",
  "research_cutoff": "2026-08-28",
  "identity": {
    "name": "בני דן 54-56",
    "city": "תל אביב",
    "developer": "אקו סיטי",
    "address_label": "בני דן 54-56, תל אביב",
    "formal_neighborhood": null
  },
  "seo": {
    "h1": "בני דן 54-56 תל אביב: מגורי בוטיק לצד פארק הירקון",
    "title": "בני דן 54-56: פרויקט אקו סיטי מול פארק הירקון | nad-lan",
    "meta_description": "בני דן 54-56 בתל אביב: בניין בן 8 קומות בקו הראשון לפארק לפי אקו סיטי. עובדות מאומתות, סטטוס, סביבה, מרפסות וכלי בדיקה לרוכש.",
    "og_title": "הבית פוגש את הפארק: בני דן 54-56",
    "og_description": "הכירו את פרויקט אקו סיטי לאורך פארק הירקון, עם הפרדה ברורה בין עובדות, טענות היזם, סימולציות ונתונים שעדיין דורשים אישור."
  },
  "hero": {
    "eyebrow": "אקו סיטי | פארק הירקון",
    "headline": "כשהפארק הוא חלק משגרת הבית",
    "summary": "לפי אקו סיטי, מדובר בבניין בוטיק בן שמונה קומות בקו הראשון לפארק הירקון, עם חזיתות פתוחות, מרפסות עמוקות וחניה רגילה. פרטי כל יחידה דורשים אישור נפרד.",
    "primary_cta": "בקשו מידע עדכני מהפרויקט",
    "secondary_cta": "פתחו את רשימת הבדיקות לרוכש"
  },
  "facts": [
    {"label": "יחס לפארק", "value": "אקו סיטי מציגה את הפרויקט לאורך פארק הירקון", "fact_id": "B-002"},
    {"label": "גובה", "value": "שמונה קומות לפי היזם", "fact_id": "B-003"},
    {"label": "סטטוס", "value": "בשיווק ולקראת ביצוע, נכון ל-28.08.2026", "fact_id": "B-007"},
    {"label": "אכלוס מתוכנן", "value": "2028 לפי היזם", "fact_id": "B-008"}
  ],
  "sections": [
    {
      "id": "story",
      "heading": "הפארק כתוכנית יומית",
      "body": [
        "הסיפור מתחיל בשגרת הליכה, ריצה, רכיבה ופנאי לאורך הפארק, ולא בסופרלטיבים שאינם ניתנים לבדיקה.",
        "כל מבט מהדירה יוצג כצילום, הדמיה או סימולציה, עם מקור ותאריך."
      ]
    },
    {
      "id": "residences",
      "heading": "מרפסות, חזיתות ודירות",
      "body": [
        "אקו סיטי מציינת חזית פתוחה לכל הדירות, מרפסות עמוקות וחניות רגילות.",
        "הטענות יוצגו כטענות היזם; מידות, הצמדות וזמינות יופיעו רק לפי תוכנית ופיד מאושרים."
      ]
    },
    {
      "id": "location",
      "heading": "צפון תל אביב לאורך פארק הירקון",
      "body": [
        "עד לאימות GIS לא תיקבע תווית רשמית של הצפון הישן או הצפון החדש.",
        "הסביבה תוצג לפי פארק, תחבורה, חינוך, קהילה ושירותים, ללא מרחקים מומצאים."
      ]
    },
    {
      "id": "buyer-journey",
      "heading": "לראות, לבדוק ורק אז לפנות",
      "body": [
        "הקורא בודק את הבניין, המרפסת, המבט לפארק, הסביבה ומסמכי העסקה.",
        "מלאי, מחיר ומספר יחידות נשארים כבויים ללא מקור רשמי."
      ]
    }
  ],
  "faq": [
    {
      "question": "האם כל הדירות פונות לפארק?",
      "answer": "אקו סיטי מציינת שכל הדירות נהנות מחזית פתוחה. יש לבדוק כל יחידה בתוכנית המכר; אין בכך הבטחה לנוף פתוח לתמיד.",
      "fact_ids": ["B-004", "B-014"]
    },
    {
      "question": "כמה קומות יש בבניין?",
      "answer": "לפי עמוד אקו סיטי שנבדק ב-28 באוגוסט 2026, הבניין מתנשא לגובה שמונה קומות. יש להתאים את המודל לתוכניות המאושרות.",
      "fact_ids": ["B-003"]
    },
    {
      "question": "כמה דירות יש בפרויקט?",
      "answer": "מספר הדירות הכולל לא אומת במקור ראשוני שנמסר לחבילה ולכן אינו מוצג.",
      "fact_ids": ["B-012"]
    },
    {
      "question": "מה סטטוס הפרויקט ומתי האכלוס?",
      "answer": "נכון ל-28 באוגוסט 2026, אקו סיטי מציגה את הפרויקט בשיווק ולקראת ביצוע, עם יעד אכלוס בשנת 2028. יש לרענן את הנתונים ולבדוק את המועד החוזי.",
      "fact_ids": ["B-007", "B-008"]
    }
  ],
  "cta": {
    "pre_inventory": "בקשו מידע עדכני מהפרויקט",
    "post_inventory": "בדקו דירות ותוכניות",
    "secondary": "פתחו את רשימת הבדיקות לרוכש"
  },
  "disclosure": "עמוד זה הוא עמוד מידע עצמאי של nad-lan.co.il ואינו האתר הרשמי של אקו סיטי. מלאי, מחיר, מפרט, היתר, מועד מסירה, חניה והצמדות מחייבים רק לפי מידע עדכני מהיזם ומסמכי העסקה.",
  "fact_register_ids": ["B-001", "B-002", "B-003", "B-004", "B-005", "B-006", "B-007", "B-008", "SH-001", "SH-002"],
  "inventory": null,
  "price": null,
  "geo": null,
  "media": []
}
